{
  "schema_version": 1,
  "id": "unflickering_valor",
  "name": {
    "en": "Unflickering Valor"
  },
  "rarity": 5,
  "weapon_type": "sword",
  "icon": "weapons/unflickering_valor/icon.png",
  "source": {
    "site": "Wuthering Waves Wiki",
    "page_url": "https://wutheringwaves.fandom.com/wiki/Unflickering_Valor",
    "verified_at": "2026-10-02",
    "revision_id": 94156
  }
}
