{
  "schema_version": 1,
  "id": "veritys_handle",
  "name": {
    "en": "Verity's Handle"
  },
  "rarity": 5,
  "weapon_type": "gauntlets",
  "icon": "weapons/veritys_handle/icon.png",
  "source": {
    "site": "Wuthering Waves Wiki",
    "page_url": "https://wutheringwaves.fandom.com/wiki/Verity%27s_Handle",
    "verified_at": "2026-10-02",
    "revision_id": 100115
  }
}
