{
  "schema_version": 1,
  "id": "novaburst",
  "name": {
    "en": "Novaburst"
  },
  "rarity": 4,
  "weapon_type": "pistols",
  "icon": "weapons/novaburst/icon.png",
  "source": {
    "site": "Wuthering Waves Wiki",
    "page_url": "https://wutheringwaves.fandom.com/wiki/Novaburst",
    "verified_at": "2026-10-02",
    "revision_id": 25424
  }
}
