{
  "schema_version": 1,
  "id": "guardian_gauntlets",
  "name": {
    "en": "Guardian Gauntlets"
  },
  "rarity": 3,
  "weapon_type": "gauntlets",
  "icon": "weapons/guardian_gauntlets/icon.png",
  "source": {
    "site": "Wuthering Waves Wiki",
    "page_url": "https://wutheringwaves.fandom.com/wiki/Guardian_Gauntlets",
    "verified_at": "2026-10-02",
    "revision_id": 30870
  }
}
