{
  "schema_version": 1,
  "id": "kumokiri",
  "name": {
    "en": "Kumokiri"
  },
  "rarity": 5,
  "weapon_type": "broadblade",
  "icon": "weapons/kumokiri/icon.png",
  "source": {
    "site": "Wuthering Waves Wiki",
    "page_url": "https://wutheringwaves.fandom.com/wiki/Kumokiri",
    "verified_at": "2026-10-02",
    "revision_id": 94326
  }
}
