{
  "schema_version": 1,
  "id": "spectral_trigger",
  "name": {
    "en": "Spectral Trigger"
  },
  "rarity": 5,
  "weapon_type": "pistols",
  "icon": "weapons/spectral_trigger/icon.png",
  "source": {
    "site": "Wuthering Waves Wiki",
    "page_url": "https://wutheringwaves.fandom.com/wiki/Spectral_Trigger",
    "verified_at": "2026-10-02",
    "revision_id": 131341
  }
}
