{
  "schema_version": 1,
  "id": "lethean_elegy",
  "name": {
    "en": "Lethean Elegy"
  },
  "rarity": 5,
  "weapon_type": "rectifier",
  "icon": "weapons/lethean_elegy/icon.png",
  "source": {
    "site": "Wuthering Waves Wiki",
    "page_url": "https://wutheringwaves.fandom.com/wiki/Lethean_Elegy",
    "verified_at": "2026-10-02",
    "revision_id": 94687
  }
}
