{
  "schema_version": 1,
  "id": "lustrous_razor",
  "name": {
    "en": "Lustrous Razor"
  },
  "rarity": 5,
  "weapon_type": "broadblade",
  "icon": "weapons/lustrous_razor/icon.png",
  "source": {
    "site": "Wuthering Waves Wiki",
    "page_url": "https://wutheringwaves.fandom.com/wiki/Lustrous_Razor",
    "verified_at": "2026-10-02",
    "revision_id": 94916
  }
}
