{
  "schema_version": 1,
  "id": "rime_draped_sprouts",
  "name": {
    "en": "Rime-Draped Sprouts"
  },
  "rarity": 5,
  "weapon_type": "rectifier",
  "icon": "weapons/rime_draped_sprouts/icon.png",
  "source": {
    "site": "Wuthering Waves Wiki",
    "page_url": "https://wutheringwaves.fandom.com/wiki/Rime-Draped_Sprouts",
    "verified_at": "2026-10-02",
    "revision_id": 98964
  }
}
