{
  "schema_version": 1,
  "id": "emerald_sentence",
  "name": {
    "en": "Emerald Sentence"
  },
  "rarity": 5,
  "weapon_type": "sword",
  "icon": "weapons/emerald_sentence/icon.png",
  "source": {
    "site": "Wuthering Waves Wiki",
    "page_url": "https://wutheringwaves.fandom.com/wiki/Emerald_Sentence",
    "verified_at": "2026-10-02",
    "revision_id": 95591
  }
}
