{
  "schema_version": 1,
  "id": "verdant_summit",
  "name": {
    "en": "Verdant Summit"
  },
  "rarity": 5,
  "weapon_type": "broadblade",
  "icon": "weapons/verdant_summit/icon.png",
  "source": {
    "site": "Wuthering Waves Wiki",
    "page_url": "https://wutheringwaves.fandom.com/wiki/Verdant_Summit",
    "verified_at": "2026-10-02",
    "revision_id": 94935
  }
}
